article_text,article_id,article_URL,article_heading,category,article_date,article_page,article_page_sequence,article_snippet,article_Trove_URL,article_edition,article_title_id,article_title_title,article_relevance_score,article_relevance_value
"ABORIGINAL  POPULATION.  The  annual  report  of  the  Board  for  the  Protection  of  Aborigines  was  laid   upon  the  table  of  the  Legislative  As  sembly  on  Tuesday  night.  It  gave  particulars  regarding  the  work  un-  dertaken  during  the  year  1905,  to  gether  with  information  as  to  the  number,  location,  and  present  condi-   tion  of  the  aborigines  throughout  the  State  and  the  means  adopted  for  their  relief.  The  census  of  the  abo-  riginal  population  showed  a  total  of  2656  full  bloods  (1068  men,  771  wo-  men,  and  817  children)  and  4477  half-castes  (1127  men,  937  women,  and  2413  children),  making  a  total  of  7133.  As  compared  with  the  year  1904,  these  figures  showed  an  in  crease  of  223.  The  death  among  the  full-bloods  had  exceeded  the  births  by  24,  the  number  being  89  and  65  respectively    while,  on  the  other  hand,  there  were  120  more  births  M  than  deaths  among  the  half-castes,  the  birth,  s  numbering  184  and  the  deaths  64.  The  figures  showed  an  increase  of  only  96,  instead  of  223,  according  to  the  census  taken  by  the  police.    According  to  the  latest  cen-  sus,  there  were  only  2656  full-  bloods,  as  compared  with  6540  in  the  year  ^  1882,  when  the  first  census  of  abor-  ignes  was  taken.  There  had  been  ^  an  increase  in  the  number  of  half-  castes  from  2379  to  4477  during  the  same  period.   ——————  There  was  a  disorderly  all-night  sitting  in  the  State  Parliament  on  Thursday  night  last  week,  when  the  anti-Gambling  Bill  was  discussed.  Miller  was  ordered  to  be  remo-  ved  from-the  Chamber,  but  left  before  the  Sergeant-at-Arms  reached  him.  One  mem-  ber  called  another  member  a  liar,  and  a  few  heated  words  followed.  One  witness  in  the  land  cases  said  that  Mr  Crick's  policy  saved  the  country  £20,000,000.  Several  Victorian  Mayors  have  announ-  ced  that  they  will  keep  teetotal  cupboards  in  future.  Judge  Heydon,  President  of  the  Arbitra-  tion  Court,  remarked  the  other  day  that  he  was  afraid  the  Arbitration  Act  was  on  its  death  bed.",161473658,https://api.trove.nla.gov.au/v3/newspaper/161473658,ABORIGINAL POPULATION.,Article,1906-09-01,1,1,The annual report of the Board for the Protection of Aborigines was laid upon the table of the Legislative Assembly on Tuesday night. It gave,https://nla.gov.au/nla.news-article161473658?searchTerm=aboriginal,,700,The Ulladulla and Milton Times (NSW : 1891 - 1917),212.8419647216797,very relevant
"ABORIGINAL  MURDER.   Two  aboriginals  named  Billy  and  Joe  have  been  committed  tor  trial  at  Georgetown,  in  Northern  Queensland,  on  a  charge  of  murdering  a  black  ex-trooper  named  Barney.  Six  spears  penetrated  the  victim's  body,  tomahawks  having  also  been  used.  Three  broken  spear  points  were  taken  from  Barney's  body,  and  were  produced  in  court  three   joints  of  the  vertebrae  with  another  spear  point  embedded  therein  were  also  shown,  while  another  joint  was  also  pierced  with  a  spear.  The  jawbone  was  broken  and  hacked  with  tomahawks,  and  a  fishbone  was  found  embedded  under  the  ribs.  Altogether  the  evidence  points  to  a  most  savage  and  brutal  murder.",183944300,https://api.trove.nla.gov.au/v3/newspaper/183944300,ABORIGINAL MURDER.,Article,1902-10-10,15,15,"Two aboriginals named Billy and Joe have been committed tor trial at Georgetown, in Northern Queensland, on a charge of murdering a black ex-trooper named Barney.",https://nla.gov.au/nla.news-article183944300?searchTerm=aboriginal,,891,"The Week (Brisbane, Qld. : 1876 - 1934)",212.8419647216797,very relevant
"j.ine  l'liuippine  visitors,  Lieutenant  Col   one!  Smith  and  Captain  Bottoms,  having  expressed  a  strong  desire  to  see  the  boom  erang  thrown,  Mr  A  lleston  was  ap-  pealed  to  and  he  obc-nned  a  Prasei  Is  lind  aboriginal  to  give  a  diaplti)  m  the  Dvhibition  Ground  on  Saturda)  morning  Besides  the  two  United  ¿staten  aim)  _(Ji  ceis,  Ure  parti  piesent  included  itbe  Pic  auer,  Mr  Atlee  Hunt,  AL  John  Lealhy,  Air  JoJin  Stevenson,  and  Senator»  i'la)   ford  and  Higgs  It  appears  tint  Colono]  Smith  ivan  incredulous  about  the  return  of  a  boomerang  and  seeing  wa»  neeessar)  to  a  belief  The  Prasei  Is]  mdei  threw  Hie  right  .end  left  hand  boomerangs  in  the  air  and  along  the  ground  for  about  twentj  minutes  until  Colonel  Smith's  scepticism  -was  completely  overcome  There  ?icing  no  .available  woomera  »pear  throw-   ing  aboriginal  Mr  Me»ton  himself  gave  a  -ucces&ltful  display  witlh.  that  weapon  to  show  how  it  w.is  used  Captain  Bottoms'  experiments  with  the  speai  and  boomer  ang  caused  a  few  pimío»  The  whole  pal  ty  thanked  Mt  Meston  heartily  for  vi  bat  the)  regarded  a»  a  \er)  pleasant  and  in  (structive  lwlf-rioui  the  visitors,  bang  «peciall)  pleased  The  Prennei  arranged  for  the  piesentation  of  some  choice  boom  criçgs  and  dillv  bag»  to  the  Philippine  visitors  a»  mementoes  of  ifcheir  visit",19343598,https://api.trove.nla.gov.au/v3/newspaper/19343598,ABORIGINAL WEAPONS.,Article,1905-06-28,4,4,"The Philippine visitors, Lieutenant-Colonel Smith and Captain Bottoms, having expressed a strong desire to see the boomerang thrown, Mr. A. Meston was",https://nla.gov.au/nla.news-article19343598?searchTerm=aboriginal,,16,The Brisbane Courier (Qld. : 1864 - 1933),212.8419647216797,very relevant
"ABORIGINAL  WORKSHOPS.   At  tho  last  meeting  of  the  New  South  Wales  Naturalists'  Club  Mr,  Whltelegge  contributed  some  interesting  notes  on  ""Aboriginal  Work  shops.""  These  workshops  are  the  spots  where  the  blacks  carried  on  the  manufacture  of  their  various  stone  implements,  and  are  to  be  found  at  various  places  along  the  coast,  sifch  as  at  Cronulla.  Botanv.  .  Maroubra.  nnrlnin-1.   Deewhy,  Bondl,  &c.  A  very  typical  one  at  Bondl  was  visited  by  the  club.  Here,  on  an  nrqa  covering  about  two  acres  stone  .clip  pings,  and  even  perfect  stone  implements,  are  to  be  picked  up.  Here  the  aboriginals  brought  from  even  distances  of  sixty  miles  or  more  pieces  of  stone  such  as  chert  quartz,  basalt,  &c.,  from  which  to  fashion  their  va-  l  rious  lmpiements,  and  leaving  in  circles,  about  a  yard  In  diameter,  many  small  drip  pings  of  stone.  The  various  Implements  de  scribed  were:—  (a)  Fish  spear  points,  triangu  lar  In  section  (b)  barbed  spear  points,  wedge  shaped  In  section,  and  Invariably  carved  in  the  thick  end:  (c)  broad  flakes,  with  a  stout  base,  and  at  least  one  cutting  edge  (d)  en  graving  toolB,  generally  oval  in  shape,  with  blunt  ends,  and  serrated  edges  (e)  triangular  instruments,  with  a  stout  base,  and  acute  apex,  probably  used  as  .  drills  or  punches:  (f)  gouges,  with  straight  or  curved  cutting  edges  (h)  tomahawks.  In  Illustration  of  his  remarks  Mr.  Whltelegge  exhibited  about  1000  speci  mens  and  also  many  drawings.  .",229071109,https://api.trove.nla.gov.au/v3/newspaper/229071109,ABORIGINAL WORKSHOPS.,Article,1902-02-11,2,2,"At the last meeting of the New South Wales Naturalists' Club Mr, Whitelegge contributed some interesting notes on ""Aboriginal Workshops."" These workshops are the spots where",https://nla.gov.au/nla.news-article229071109?searchTerm=aboriginal,,1178,"The Australian Star (Sydney, NSW : 1887 - 1909)",212.8419647216797,very relevant
"ABORIGINAL  CONCERT.   On  December  19th  a  variety  con-   cert  will  be  given  in  the  Shire  Hall   by  the  Yarrabah  concert  company.  The  Yarrabah  company  gave  an  ex-   cellent  entertainment  some  time  ago,   and  we  fully  expect  the  boys  have  been  much  further  advanced  in  con-  cert  matters  since  then.  Consequent-  ly  Mr.  Gribble  and  his  concert  boys   will  be  sure  to  be  greeted  with  a  big   house,",44426752,https://api.trove.nla.gov.au/v3/newspaper/44426752,ABORIGINAL CONCERT.,Article,1906-11-21,2,2,On December 19th a variety concert will be given in the Shire Hall by the yarrabah concert company. The Marraban company gave an,https://nla.gov.au/nla.news-article44426752?searchTerm=aboriginal,,79,"Morning Post (Cairns, Qld. : 1897 - 1907)",212.8419647216797,very relevant
"ABORIGINAL  LABOR.             In  connection  with  the  employment   of  aboriginals,  it  is  reported  by  the  Department  in  Brisbane,  that  some  of  the  sugar-growers  have  been  sound-  ing  the  department  about  the  pros-  pect  of  securing  aboriginal  labor  for  the  canefields,  a  few  natives  being  employed  in  the  Bundaberg  district  by  way  of  trial.  It  is  believed  that  northern  aboriginals  would  be  spec-  ially  suitable  for  this  work,  and  if  the  proposed  station  were  established  it  would  be  a  great  assistance  in  re-  cruiting  labor.",44455742,https://api.trove.nla.gov.au/v3/newspaper/44455742,ABORIGINAL LABOR.,Article,1907-02-05,2,2,"In connection with the employment of aboriginals, it is reported by the Department in Brisbane, that some of the sugar-growers have been",https://nla.gov.au/nla.news-article44455742?searchTerm=aboriginal,,79,"Morning Post (Cairns, Qld. : 1897 - 1907)",212.8419647216797,very relevant
"Aboriginal  Festivities.   Amongst  the  smaller  sensations  of  Christ-  mas  time  at  Rolland'sPlains  was  an  abori-  ginal  children's  treat  given  them  by  their  Missionary.  After  a  good  supply  of  tea  and  buns  all  children  and  women  present  re-  ceived  useful  Cbristtnas  gifts.  A  merry  time  was  spent,  and  adults  and  children   were  profuse  in  their  thanks  to  those  friends  who  had  assisted  their  Missionary  to  give  them  such  a  happy  time.  On  New  Year's  eve  Wauchope  aborigi-  nes  were  all  alive  with  something  unusual.  Visitors  from  Rolland's  Plains  and  Burnt  Bridge  arrived  early  in  the  day.  Soon  after  dinner  the  people  gathered  in  and  around  the  the  Mission  Hall.  The  Rev.  E.  H.  Shaw  aud  Mr.  J.  K.  Andrews  were  present,  and  gave  much-appreciated  addresses  to  the  gathering.  The  children  the  gave  some  action  songs,  and  the  young  men  gave  a  se-  lection  on  the  leaves  which  was  much  appre-  ciated.  A  plentiful  tea  was  the  next  item  -  the  response  to  which  proved  the  people's  appetites  were  in  first-class  order.  A  lolly  scramble,  and  the  distribution  of  numerous  useful  gifts  formed  part  of  the  programme.  Games  were  kept  up  till  dusk,  after  which  the  hall  was  filled,  and  a  long  list  of  songs  and  recitations  was  gone  through  —  the  meet-  ing  being  brought  to  a  close  by  singing  ""God  [?]  till  we  meet  again.""  Contri-  buted.  Senders  of  pictorial  post  cards  to  friends  in  the  old  country  are  reminded  that  all  those  decorated  with  tinsel  are  put  in  the  waste  paper  basket.  The  decorative  material  is  composed  of  particles  of  finely-ground  glass  and  metallic  powder,  which  gets  under  the  nails  and  up  ihe  nostrils  of  the  sorters.  Hence  the  edict  of  prohibition.",104879809,https://api.trove.nla.gov.au/v3/newspaper/104879809,Aboriginal Festivities.,Article,1908-01-18,4,4,Amongst the smaller sensations of Christmas time at Rolland's Plains was an aboriginal children's treat given them by their Missionary. After a good supply of tea and,https://nla.gov.au/nla.news-article104879809?searchTerm=aboriginal,,516,The Port Macquarie News and Hastings River Advocate (NSW : 1882 - 1950),212.8291473388672,very relevant
"Aboriginal  Vendetta.   The  Australian  aborigine,  lowest  in  the  human  scale,  has  his  vendetta,  though  it  is  not  invariably  revenge  that  he  seeks.  How  his  mind  in  the  matter  works  has  been  shown  by  Darwin.  The  native  servant  of  a  West  Australian  magistrate  went  one  day  to  his  master,  saying  that  one  of  his  wives  had  died  of  disease.  He  must   go  away,  therefore,  to  a  distant  tribe  and  spear  a  woman  to  satisfy  his  sense  of  duty  to  the  dead  woman.  ""If  you  do  so,  I'll  send  you  to  prison  for  life,""  said  his  master.  For  a  year  the  man  hung  about,  looking  wretched  and  ill,  and  complaining  that  he  could  not  eat  nor  sleep,  as  the  spirit  of  his  wife  haunted  him  because  he  had  not  taken  another  life  for  hers.  At  last  he  disappeared.  A  year  later  he  returned  in  high  condition.  There  was  no  legal  evidence  against  him,  but  it  was  known  that  he  had  gone  to  a  distant  tribe,  had  speared  a  woman  to  death,  and  so,  as  he  thought,  appeased  the  spirit  of  his  departed  wife.",107207589,https://api.trove.nla.gov.au/v3/newspaper/107207589,Aboriginal Vendetta.,Article,1907-01-25,21,21,"THE Australian aborigine, lowest in the human scale, has his vendetta, though it is not invariably revenge that he seeks. How his mind in the",https://nla.gov.au/nla.news-article107207589?searchTerm=aboriginal,,514,The Peak Hill Express (NSW : 1902 - 1952),212.8291473388672,very relevant
"ABORIGINAL  CHILDREN.   A  deputation  introduced  by  Mr  Briner,  M.L.A,        consisting  of  Mr  G  E  Hooley  (president),  Mr.  T.  Colbrook  (secretary),  Mr.  E  J  Telfer,  and  Mr.  H  Trenchhard,  representing  the  New  Mouth  Wales  Board  of  MLSSIOIIS  to  tho  Aborigines,  waitud  upon  Mr  Peny  (Minister  loi  Education),  and  requested  that  tho  children  ot  the  aborigines  camped  at  Burnt's  Bridg*  bo  nllov\cd  lo  attend  tho  Public  school  at  Unrolca  It  was  assailed  that  great  moral  benefits  would  accrue  to  tho  aboiigiuul  children  by  associa-   tion  with  the  white  seholara   lu  roply,  Mr  Pony  saul  that  the  samo  question  had  been  raised  all  ovoi  the  State,  but  patents  IIIHO   lutely  relused  to  nllo\  their  children  to  attend  thc¡  same  school  as  aborigines  He  promised,  however,  |   that  ho  would  have  au  o  ft  I  em  I  íeport  made  upon  the   niüttci   '  BISriGUrtED  FOll  ML'  w  the  despairing-  cry  of  thoiitmnds  aílhitid  with  uusightly  humours  of  tho  »km  scalp  und  hair.  Do\uu  IÍUIÍM.  what  this  disii  ruiatlon  meant,  toseiwitite  souls  '  Ii  mean?»  mol  itioii,  »(.elusion  It  ni  a  b  ii  to  HOC  tal  and  busiiRns  »uctcsti  Do  ^  on  w  onder  that  dcsi  an  ati/ts  upon  these  suit  eren,  whin  doctors  fmJ   standard  lemedics  fail,  an  I  nostrums  provu  wurwc  tlmn  use!  us  f  Skin  humo  JW  at  a  ni  ist  ob^titi  ite  to  euro  or  e\  en  rehctc  lils  an  ciisy  matta  U  dum  to  euro  them  but  quito  unothei  thing  to  do  so  CITJICUUA  leniuiias  lane  earned  tho  n_ht  to  hu  called  bkm  Bpuctilcs  because  tor  >earn  they  hate  met  with  most  rtmaiknulu  «HCCLS.  lhere  aie  cases  they  c  «mot  eulo,  but  thu>  are  f(  w  indeed  Tt  is  no  limit  drawn-out  PYpensivo  experiment  A  wurm  bath  with  CUIICUR.  SU  Al'  lo  tltunse  the  skin  and  scuI.M.f  crusts  and  seid  es  and  not  ten  thu  thickened  cuticle,  tuid  a  miio'le  anointing  with  CUIICUltV  Ointment,  thu  gieat  «km  curt  to  instantly  alluj  itching  an  1  irritation,  und  Huotlio  and  heal  will  prove  inoro  convincing  In  the  aevcrcHt  forms  of  itching  burning  bleeding,  nculj,  trusted*  uni   ni  in  [tly  humour«,  -with  loss  of  hair,  thun  i  ages  ot  .printed   trailer  -Advt   Tor  Childrens  Hacking  Cough  utnight,  Woods'Great   Peppermint  Cure  IB  tid  -Advt   lim  opening  of  tho  Crookwell  Itudwny  is  illus  rated  m  this  week's  ""  Sydney  Mail  *'-Advt",14452296,https://api.trove.nla.gov.au/v3/newspaper/14452296,ABORIGINAL CHILDREN.,Article,1902-05-01,5,5,"A deputation introduced by Mr. Briner, M.L.A., consisting of Mr. G.E. Bo[?]oley (president), Mr.T. Colbrook (secretary), Mr. E.J.Telfer, and Mr.H. Tronchard, representing the New South Wales",https://nla.gov.au/nla.news-article14452296?searchTerm=aboriginal,,35,The Sydney Morning Herald (NSW : 1842 - 1954),212.8291473388672,very relevant
"ABORIGINAL  MURDER.   The  Commissioner  of  Police  has  received  a  telegram  stating  that  an  aboriginal  named  Jacky,  who  it  is  alleged  shot  a  gin  named  Marian  dead  at  Nelson  on  Monday,  had  been  apprehended  at  Nelson,  and  charged  with  the   offence.",14769442,https://api.trove.nla.gov.au/v3/newspaper/14769442,ABORIGINAL MURDER.,Article,1906-05-04,8,8,"The Commissioner of Police has received a telegram stating that an aboriginal named Jacky, who it is alleged shot a gin named Marian dead at Nelson on Monday, had been",https://nla.gov.au/nla.news-article14769442?searchTerm=aboriginal,,35,The Sydney Morning Herald (NSW : 1842 - 1954),212.8291473388672,very relevant
"ABORIGINAL  SPEECH.   At  a  meeting  of  the  Royal  Society  of.  Tasmania  on  Monday,  Mr  Herman  Ritz,  M.A.,  read  a  paper,  entitled  ""An  introduction  to  aboriginal  speech  in  Tasmania.""  Mr  Ritz  said  the  life  of  a  population  invariably  assumed  a  form  which  largely  depended  on  the   climate  and  geographical  features  and  the  facility  of  intercourse  with  the  denizens  of  other  lands.  If  they  took  heed  they  might  hear  the  sounds  and  the  voices  that  passed  away  with  Truganini.  To  the  observing  ear  of  the  scientists  the  remnants  of  the  feasts  of  the  aboriginals,  their  imple-  ments,  and  the  scanty  records  of  their   words  and  doings  spoke  in  the  lan-  guage  of  their  own  of  those  whose  places  we  had  taken  for  good  or  ill.  It  was  the  words,  the  records  of  the  actual  songs  of  the  voice  that  was  still,  that  he  would  confine  their  attention,  and  their  present  purpose  was  to  clear  the  ground  and  mark  out  the  founda-  tion  for  constructing  a  scientific  re-  production  of  the1  language  of  the  aboriginals  of  Tasmania.  As  far  as   he  was  aware,  the  work  done  in  that  direction  had  not  hitherto  been  ex-  tensive.  After  stating  his  attempt  to  simplify  the  spelling,  Mr  Ritz  com-  pared  three  versions  of  an  aboriginal  song,  accounting  for  every  word,  and  explaining  the  meaning  of  the  sent-   ences.  He  said  there  was  no  sign  of  any  accidence.  The  words  seemed  in-  variable  in  form  and  widely  applicable  in  meaning.  The  words  were  pro-  bably  supplemented  by  gestures  to  define  their  exact  meaning.  In  that  respect  a  parallel  was  found  in  the  sentences  of  the  Chinese  language.  The   fact  that  the  song  existed  in  different  dialects  made  it  most  valuable.  Quite  probably  the  song  was  connected  with  some,  important  tribal  ceremonies.  One   of  the  interpretations  given  of  the  song  was  :  ""Mighty  runs  the  bush  fire.  My  heel  is  speedy  and  my  foot  is  swift.  Come,  thou,  and  run  with  the  speed  of  a  bird.  Thou  art  a  real  warrior,  a  man,  indeed  warrior,  hero!""  Mr  Ritz,  in  reply  tio  Sir  Gerald  Strickland  as  to  whether  any   observations  had  been  made  as  to  any  trace  of  the  aboriginal  tongue  amongst  the  half-castes  of  Barren.  Island,  said,  owing  to  the  mixed  dialects,  it  would  hardly  be  possible  to  find  any  trace  of  the  pure  tongue  there,  except  that  it  might  be  kept  for  secret  communi-  cation.  Since  he  studied  the  questions  he  had  gained  a  great  deal  of  informa-  tion,  and  he  hoped  to  give  further  re-  sults  at  a  future  meeting.  Dr.  Noet-   ling  and  Mr  R.  M.  Johnston  spoke  in  high  terms  of  the  value  of  the  re-  search  of  Mr  Ritz,  and  they  hoped  he  would  continue  his  studies,  and  that  the  result  would  be  placed  before  the  scientific  world.  Mr  Johnston  referred  to  some  phonograph  records  having  been  taken  of  the  native  lan-  guage  spoken  by  the  late  Fanny  Smith,  and  these  might  prove  of  great  value  to  Mr  Ritz  in  his  studies.",151930702,https://api.trove.nla.gov.au/v3/newspaper/151930702,ABORIGINAL SPEECH.,Article,1908-11-19,4,4,"At a meeting of the Royal Society of Tasmania on Monday, Mr Herman Ritz, M.A., read a paper, entitled ""An introduction to aboriginal speech",https://nla.gov.au/nla.news-article151930702?searchTerm=aboriginal,,742,"Daily Telegraph (Launceston, Tas. : 1883 - 1928)",212.8291473388672,very relevant
"Aboriginal  Arch.   The  whole  of  the  aboriginal  arch,  including  the  ti-tree  and  stringy  bark,  and  the  splendid  ferns,  will  be  sold  to-morrow,  at  noon,  under  instructions  from  the  Government,  and  the  proceeds  given  to  the  aboriginals.",174378142,https://api.trove.nla.gov.au/v3/newspaper/174378142,Aboriginal Arch.,Article,1901-05-28,4,4 S,"The whole of the aboriginal arch, including, the ti-tree and stringy bark, and the splendid ferns, will be sold to-morrow, at noon, under instructions from the Government, and the",https://nla.gov.au/nla.news-article174378142?searchTerm=aboriginal,SECOND EDITION,840,"The Telegraph (Brisbane, Qld. : 1872 - 1947)",212.8291473388672,very relevant
"ABORIGINAL  DISPLAY.   The  public  will  be  pleased  to  learn  that  our  Federation  jubilee  is  to  include  a  grand   display  by  aboriginals.  The  Home  Secretary  has  instructed  Mr.  A.  Meston  (protector  of  South  and  Central  Queensland)  to  select  fifty  picked  men  to  join  in  the  march,  and  give  a  subsequent  display  of  spear  and  boomerang  throwing.  Our  readers  will  re-  member  that  the  aboriginal  guard  was  pro-  bably  the  most  interesting  part  in  the  re-  ception  of  Lord  Lamington.   Doubtless  at  the  Federal  festivities  Mr.  Meston  will  show  a  fine  body  of  representa-  tive  aboriginals.  It  may  be  anticipated  that  under  his  guidance  this  part  of  the  programme  will  be  done  properly,  and  that  the  blacks  themselves  and  their  weapon  displays  will  be  a  revelation  to  even  a  majority  of  Queenslanders,  and  an  interest-  ing  education  for  our  school  children.   The  public  will  thank  the  Home  Secretary  for  this  addition  to  the  celebration.  Pos-  sibly  advantage  will  be  taken  of  the  blacks'  presence  in  town  to  have  a  series  of  cor-  robbories  as  well  as  a  display  of  weapons.   The  First  Regiment  is  to  find  a  team  to  go  through  the  manual  and  firing  exercises  on  New  Year's  Day,  and,  in  consideration  of  the  reputa-  tion  of  A  Company  for  proficiency  at  these  exercises,  the  most  of  the  team  will  probably  be  selected  from  that  company.  Among  other  items  promised  by  the  military  forces  are  :-Sword  exercise  by  the  field  batteries,  dismounting  drill  by  the  Garrison  Battery,  bayonet  exercise  by  the  Queensland  Rifles,  and  physical  drill  by  the  Permanent  Artillery.  The  Naval  Brigade  promise  a  display  of  cutlass  drill,  with  new  and  novel  features.  As  one  or  two  items  are  certain  to  be  added  to  the  above,  including  tent-pegging,  riding  and  driving  drill,  and  a  tug-of-war  on  horseback,   a  liberal  and  attractive  programme  should  be   forthcoming.",19043852,https://api.trove.nla.gov.au/v3/newspaper/19043852,ABORIGINAL DISPLAY.,Article,1900-12-04,4,4,The public will be pleased to learn that our Federation jubilee is to include a grand display by aboriginals. The Home Secretary has instructed Mr. A. Meston,https://nla.gov.au/nla.news-article19043852?searchTerm=aboriginal,,16,The Brisbane Courier (Qld. : 1864 - 1933),212.8291473388672,very relevant
"ABORIGINAL  ARCH.   The  ""aboriginal""  arch  to  be  erect-  ed  in  George-street  on  the  occasion   of  the  Royal  vlsit  is  to  have  the  form  of  a   circular  arch  in  a  pyramid.  Aboriginals,  with  spears  and  shields,  will  be  placed  on  the  structure,  and  a  delightful  effect  will  be  obtained  by  decorations  with  characteris-  tic  flora  and  fauna.  The  arrangements  are  in  the  hands  of  Mr.  A.  Meston,  Protector  of  Aboriginals.  It  is  probable  that  the  arch  will  be  placed  near  the  Lands  Office  site.",19122980,https://api.trove.nla.gov.au/v3/newspaper/19122980,ABORIGINAL ARCH.,Article,1901-04-03,5,5,"The ""aboriginal"" arch to be erected in George street on the occasion of the Royal visit is to have the form of a circular arch in a pyramid. Aboriginals,",https://nla.gov.au/nla.news-article19122980?searchTerm=aboriginal,,16,The Brisbane Courier (Qld. : 1864 - 1933),212.8291473388672,very relevant
