article_text,article_id,article_URL,article_heading,category,article_date,article_page,article_page_sequence,article_snippet,article_Trove_URL,article_edition,article_title_id,article_title_title,article_relevance_score,article_relevance_value
"ABORIGINAL  NEWSPAPER.   A  unique  newspaper  has  been  published  in  North  Queensland.  A  little  while  ago  the  Rev.  E.  R.  Gribble,  super  intendant  of  the  aboriginal  station  at  Yarrahah  near  Cairus,  issued  a  small  double  sheet  called  the  ""Yarrabah  News""  but  the  name  has  now  been  changed  to  the  ""Aboriginal  News""  ""as  this  is  the  only  newspaper  issued  purely  in  the  interest  of  the  aborigines  of  Australia.""  The  paper  is  entirely  ""composed""  by  the  aboriginal  inmates  of  the  mission,  under  the  direction  of  the  missionaries.  Rev.  E.  S  Chase  being  at  present  in  charge.  On  the  first  page  is  printed  the  aims  of  the  mission  and  the  prayer  used  by  the  Mitchell  River  Mission  party.   On  the  opposite  page  is  reprinted  the  notice  that  is  posted  at  the  headquarters  of  the  mission  :—  ""Visitors  are  kindly  requested  not  to  use  the  undermentioned  words  when  speaking  to  members  of  the  mission  :—(Gin'  (use  'black  woman'),  'niggers'  (use  'blacks'  or  'black  people)""  'Mary'  (use  'wife')  'Benjamin'  (say  'husband').   Editorially  the  opinion  is  expressed  that  it  is  time  something  was  done  by  the  Commonwealth  Parliament  to  prevent  the  sale  of  opium,  and  it  is  added  that  it  is  not  generally  known  that  the  natives  of  Australia  do  not  smoke  opium,  but  drink  it.  It  is  also  stated:  ""We  do  not  think  the  change  will  be  to  the  best  interests  of  the  blacks  from  the  care  of  Dr.  Roth  to  that  of  the  police.  ""   A  method  by  which  hens  can  be  induced  to  furnish  eggs  Iii  autumn  nnd  winter  is  culled  tho  ""dual  system,""  and  consists  in  keeping  the  hens  in  couples  In  coops  of  a  cortnin  urea  with  a  small  run  attached  to  «ich.  Much  attention  is  paid  te>  the  lint  tiru  of  tho  soil  anel  to  food  and  cleanliness.  Fowls  havo  boon  kopt  under  those  coneii  tltTiis  for  several  years,  mid  the  yield  of  eggs  lins  averngcii  fen-  the  past  (Ive  yours  114.  for  each  fowl.  Tho  system  advoca  toil'  Involves  neither  radical  chnnge  nor  expense,  mid  Is  worthy  of  a  trial  hy  all  who  keep   fowls.   Art*.  Hut-bunk,  the  grower  of  strange  dow-  el's  In  San  Francisco,  has  produced  a  new  carnation,  the  peculiarity  eif  which  Is  that  on  tho  llrst  elny  the.  colour  Is  snow  whlto    on  the  second  day  plnk-iililte    und  tliero  nfter  a  deep  red  until  the  blossom  fades.   Mr.  T.  C.  Kerry,  tho  well-known  explor-  er,  in  his  yacht  I'antlorn,  recently  visltud  tho  lohi'ly  ¡shuni  of  Tiistun  Hu  Cunha,  nnel  some  noigliboiii-inir  islets  lu  tim  South  At  Inntic,  Tristan  Pa  Cunnii,  which  Iles  out  of  tins  track  of  most  Mouth  Atlantic  ves-  sels,  was  peopled  by  a  few  artillery-men,  who  wot-u  sent  there  bv  thu  Ih-ltlsh  ïlovcni  nir-lil  In  1S10  to  keep  waleli  (over  1.'00  milos  of  sen)  cm  Xnpoleon's  movements  In  St.  Helen«.  At  the  time  oi  the  Challeng-  er  expedition's  visits  In  1H7ÎI,  thu  colony  hail  grown  to  seventy  people    now  it  lins  IneriMiHt'd  by  ton.  ""Tim  men,  Mr.  Kerry  soys,  aro  very  pooi-ty  dressed-only  «i  few  have  jucknts-but  till  ave  healthy.  Tho  women,  who  aro  coniely-liioliing,  aro  but-  ter  off.  Tim  Htllu  community  has  no  money,  nu  church,  no  law.  The  Island  is  so  over-run  with  rats  that  corenl  crops  cannot  bo  groiVn.   At  tho  N'owitliuln  furo  moot  I  net1.  1'utricle*  Kenno  tlv,  a  Jnckoy,  was  kllleil  through  lils  mount  fal-  ling  (luring  n  race.   Old  silver  coinage  to  tho  nninuiit  of  JCa.400,  IKIll,  Which  mi«-  Iles  In  the  Ht.  Potorshtirg  mint.  Is  to  lw  converted  Into  lintots  und  exported  to  Kngliuid  tn  ho  changed  Into  ItiiHslan  cur  roney   fur  clrciilntlon  tn  China.   Til-,  Hutton,  of  f.h'e>r|ionl,  a  member  of  tho  expedition  to  InvestIgnto  the  causes  of  trypan  osottilnsls  utiil  tick  fever  In  tim  Congo,  has  died  Utero  ut  tho  ngo  ol  tw'onty-tiluo,  .",61420643,https://api.trove.nla.gov.au/v3/newspaper/61420643,ABORIGINAL NEWSPAPER.,Article,1905-06-17,3,3,"A unique newspaper has been published in North Queensland. A little while age the Rev. E.R. Gribble, super intendent of the aboriginal station at Yarrabah near Cairns issued a small",https://nla.gov.au/nla.news-article61420643?searchTerm=aboriginal,,64,"Clarence and Richmond Examiner (Grafton, NSW : 1889 - 1915)",213.08029174804688,very relevant
"Aboriginal  Reserve.   Mr.  Foxton  (Home  Secretary)  :  It  must  be  borne  in  mind  that  even  now  the  possessor  of  a  miner's  right  had  to  find  out  what  were  Crown  lands,  because  a  miner  was  not  allowed  to  mine  on  private  property,  and  these  reserves  were  really  the  private  pro-  perty  of  the  aboriginals.  But  an  ex-  ception  had  been  made  in  favour  of   the  miner.  Now,  it  was  desired  by  the  representatives  of  the  miners  appar-  ently,  to  enable  ill-conditioned  per-  sons  who  were  not  miners—   Mr.  Browne:  You  know  better  than  that.  What  is  the  use  of  being  offen-  sive?   The  Home  Secretary:  He  did  not.   He  believed  that  that  was  the  infer-  ence  which  was  to  be  drawn.   Mr,  Browne:  I  distinctly  deny  that  any  such  inference  is  to  be  drawn.   The  Home  Secretary:  He  thought  the  hon.  gentleman  must  have  mis-  understood  him—   Mr.  Jackson  :  It  is  very  offensive  to  mining  representatives.   The  Home  Secretary:  He  could  not  see  it  at  all.  He  was  sorry  that  he  had  offended  hon.  members.  He  cer-  tainly  did  not  intend  to.   Mr.  Browne  :  Yon  said  that  the  min-  ing  representatives  wanted  to  allow  ill-conditioned  persons  to  go  on  these   reserves.   Mr.  J.  Hamilton  :  No  be  said  per-  son  who  were  not  miners.   The  Home  Secretary:  He  might  have  expressed  himself  in  a  way  he  did  not  intend  to,  and  if  he  had  done  so,  he  was  sorry.    What  he  wanted  to  say  was  that  this  would  be  the  result,  if  hon.  members  representing  mining  constituencies  followed  the  lead  of  the  hon.  member,  Mr.  Duns-  ford,  in  this  matter.  That  would  be  the  result  of  their  action,  whether  in-  tentionally  or  otherwise.   Mr  Dunsford:  Then  you  have  not  very  much  faith  in  the  wisdom  of  the  wardens.",85557097,https://api.trove.nla.gov.au/v3/newspaper/85557097,Aboriginal Reserve.,Article,1901-09-16,53,53,"Mr. Foxton (Home Secretary): It must be borne in mind that even now the possessor of a miner's right had to find out what were Crown lands,",https://nla.gov.au/nla.news-article85557097?searchTerm=aboriginal,,269,"The North Queensland Register (Townsville, Qld. : 1892 - 1905)",213.08029174804688,very relevant
"ABORIGINAL  ^CRIMINALS.       The  residents  on  the  West  Coast  have    several  times  complained  that  aboriginals,  when  arrested  and  convicted  of  offences,  are  invariably  released  long  before  the  ex  piration  of  their  sentences,  and  turned  loose  on  the  coast  again  to  continue  their  crlminal  careers.  Another  instance  has  '.  fust  occurred,  which  has  apparently  strain  ed  the  patience  of  West  Coast  settlers  to   -  ibe  -breaking-point.  Our  Penong  corre  ipondent  writes,  under  date  July  11  —  rOMiomby,  an  aboriginal,  who  with  Peter  1  fras  sentenced  to  twelve  months'  imprison  ment  3ast  September  for  breaking  into  «e  '  '  yeral  farmbouses  during  the  absence-  of  V  fheir  occupacts,  and  who  for  some  imac  totmtable  reason  was  released  by  the  autho  rities,  has  again  begun  depredations  of  a  btmiiar  character.  This  time  he  broke-  into  JP&,  the  house  of  his  late  pursuers  (Mr.  IT.  Baunders).  but  was  captured  by  Mr.  '  ?  Sau&ders  and  taken  into  Penong  station  S!  '  r  the  purpose  of  communicating  with  e  police.  Mr.  Saunders  secured  liim,  as  if  hq  thought,  safely,  while  he  partook  of  ?:  ibme  refreshment.  In  the  meantime  Hornby  £  -  IdlsaDneared  with  his  cantor's  bicycle,  and   &  iBftade  for  Mr.  A.  lienier  e,  where  he  began  ?J  ,  '  iterations  on  the'  same  scale,  aud  is  still  \U-.  »t  large.  It  was  with  difficulty  that  ii.1'.  Momby.  was  captured  last  year,  Mounted  ,'?-  Constable.  Donegan  and  several  residents  fx  ,  Jacking  him  and  his  companion  for  over  j('''  jSreek.  Many  settlers  speak  significantly  S-  J  I-Htabjng  the  matter  into  their  own  hands,  sr.  :  ina  jtfomby  may  not  escape  so  lightly  as  «?'  j  le'sdici  »t£e  Jast  tune.'  The  Sheriff  (Mr.  0.  £  ?  i^Setoomburgk)  explains  that  in  the  case  I  ijT-Moxriby,  the  prisoner  received  two  cumu  ??  '  atlve  -sentences  of  six  months  each,  but  as  '--  tie^eopncVgentenc©  was  illegal,  he  was  dis  ?'-'  Wiargea-  The  other  natives  were  released  ii  4&»UM  tb«  $flnfiaew»i  WQ8  killing  them.,",88167936,https://api.trove.nla.gov.au/v3/newspaper/88167936,ABORIGINAL CRIMINALS.,Article,1905-07-29,38,38,"The residents on the West Coast have Several times complained that aboriginals, When arrested and convicted of offences, are invariably released long before the",https://nla.gov.au/nla.news-article88167936?searchTerm=aboriginal,,291,"Chronicle (Adelaide, SA : 1895 - 1954)",213.08029174804688,very relevant
"ABORIGINAL  SOCIAL.  A  unique  social  was  held  at  Lawrence    on  Wednesday.  It  was  arranged  by  abori-  gals  of  the  Clarence,  and  most  parts of  the  district  was  presented.  The  notice        was  also  followed:  Admission,  1/  whitefellas,  2/.  Indies  -    cordially  invited.  Supper  provided.  The  dancing  was  not  of  the  native  cor-  rlored  fashion,  hut  the  programme,    which  was  not  exhausted  till  daybreak  compromised  the  dances  that  are  ordinaraly  found  on  the  bill  of  a  stylish  untied,.  mush  as  the,  waltz,  lancers,  and  mottisch,  ... A  European  pianist  applied  the  music,  and    a  local  Caterer  provided  refreshments.  Tho  women  went  to  a  lot  of  trouble  to aborn  themselves  for  the  occasion,  and  several  were  frocked  in  bright  coloured  mills.  Dan-    cing  shoes  were  purchased,  and  the  head-  gear  was  not  off  in  ruy  ribbons,  the  darking  being  loud  of  deep  colours.  This  is  the  sfirst  social  of'its  kind  that  has  been'.  held  in  the  district.      ""IUn  T'lillot  :Ia.  ?niAiec  g  Telnnaini  .  'The.  Manyor  ft  hlobart  mlreulated  tee  nct  h:im  .nt  eulrncial  receptioln,  SA  fire  kolrko  eut  earley  .?teteeley  morn  ine  in  no  ,e  wilnhmeln  erooeac  trL  atle  l~n  ran  nhaft  of  Illaoch  4i.mi  net  lrkrn.Itill,  The  Popplllet·h)iedn  erre  klestroynel,  endl  :work'  h  thee  mine  will.  beo  supniei?id  for  cano  Mlr,  1'tlddlell,  tihe  T?  tmurer,  'ne  tnnhaie  in  a  low  y(ara  e  he  Il  ockrn  nnat  w""ill  lie  anM  of  tInt  nonet  bOneauntil  Tlhcenr  of  Sycdl  ncy.  liBe  nlovernen't  hopIinl  ""to  reheliln!  tio  wh)lole  aniet,  nlHI  reenenv  ev.cyflenl'  Re  tn  ohnjecliatol  ninihreaele'r,  ""  o  Iieutetanlt  lhacle?ltoan,  Ithe  I  leter  ol  the  eouth  PIolaer  eoxanlitlon.'rh'  eriel  n  t  'o  eenu.tleo  by,  tIhe  Il.M.S.  Inlrdia  front  louldon  on  nMonday  ,lg  ht,.  A  Peace  StIC  tyl  wan  lornied  in  Sytdnoy  laset  enlpht.  T'lien  noolty  ewill  e  ln~'ntour.  to  naeure  the  ndlopllon  nl  nrihit'at·itot  la  In  tornatildlhtl  tliet,  .  -.",100451425,https://api.trove.nla.gov.au/v3/newspaper/100451425,ABORIGINAL SOCIAL.,Article,1907-11-27,2,2,"A unique social was held at Lawrence on Wednesday. It was arranged by aboriginals of the Clarence, and most parts of the district were represented. The notice",https://nla.gov.au/nla.news-article100451425?searchTerm=aboriginal,,367,Goulburn Herald (NSW : 1881 - 1907),212.93455505371094,very relevant
"ABORIGINAL  SUPERSTITION.   A  telegram  received  at  Adelaide  from  Oodnadatta  states  that  a  death  occurred  about  a  fortnight  ago  of  an  aborigine  named  ""Navy  Tom,""  a  black,  fine  physique,  whose  portrait  appears  on  the  cover  of  Foster  Fraser's  work  ""Quaint  Subjects  of   the  King.  This  native  was  comparatively  intelligent  and  civilised,  having  been  in  the  employment  of  whites  for  many  years,  and  physically  was  about  the  finest  type  in  the  north-west.  Yet  he  died  because  another  black,  an  enemy,  pointed  a  ""bone""  atl  him.  No  amount  of  reasoning  or  ridicule  on  the  part  of  the  whites  could  save  him.  Once  a  black  has  been  ""boned""  he  simply  wastes  away,  neither  easts  nor  sleeps  properly,  and  the  end  soon  comes.  The  aborigines  are  fatalists,  and  ""Navy  Tom""  was  no  except-  tion.  Referring  to  this  telegram  the  Pro-  tector  of  the  Aborigines.  Mr  South  said  that  as  far  as  he  knew  one  of  the  chief  superstitions  of  the  aboriginals  all  over  Australia  were  that  if  ""bone  were  pointed   at  a  man  his  doom  wan  sealed.  Perhaps  the  marked  man  would  not  see  his  enemy  pointing,  but  If  ho  onco  irol  Ihu  Idcii  inio  hln  lipnd  that  thu  ov,!l  deed  bnd  been  ddiio  iim  would  olmply  plnp  nwav  nnd'  (Ue,  After  his  donih  his  trlbo  would  ko  mi  qtitut  of  Hio  cnomy  who  ipritnitedi  th.1  'hum,'  nr  wn«  nllngcd  to  lmvo  rtono  m.  end  ondvnvnr  -o  tnko  nilinmarv  vpiiRHiiro.  'Mrnn'  wan  goncrnlly  n  M'ldk  wllh  lilororfly  plilo*  'ln.iorib(i(l  upon  II,  nnd  it  was  whldn'm  W'on  p.wpl  bv  Itfl  owner.  'In  tlio  foiiIDi.  mti  jxvrt  of  Bonth  Aiiiiriiilii,'  (iddcd  Mr,  &iutii,  'vory  few  nf  Uip  niioi-lirlnriiH  know  |«f  nnytlilupt  of  dlic  old  (rllwl  eii'toniR,  Vou  JeiiMiol  roly  nn  wlmt  thev  '.ay  olthei,  I  liotiprlt  T  lmvo  novor  found  thorn  lo  1m   «-iy  flngrnnt  Hnr«.  The  full  MoodH  nre  ljing  mil,  mid  tlio  whole  nipc  In  mei'irli'l!  Jnfo  (lint  nf  tihn  oonqvorliiK  wMle.i,  Our  ffi'ent  problom  loday  l'i  how  -Ia  deal  with  (ho  l,inrminln|»  numlior  nf  Imlf-milPA,  whn  rIiciiM  not  bn  nlloM'ed  tn  wnvdnr  nlmnl  Ilia  liwh  when  dliny  mlghl  cnillv  liooomo  d  ?  fi'i'nlild  nivniliDm  of  n  nlvlllwl  eonimunily,'",109780090,https://api.trove.nla.gov.au/v3/newspaper/109780090,ABORIGINAL SUPERSTITION.,Article,1909-11-09,4,4,"A telegram receive at Adela[?] from Oodmadatta stated that a death occurred about a fortnight ago of an aborigine named ""Navvy Tem,"" a black a fine physique",https://nla.gov.au/nla.news-article109780090?searchTerm=aboriginal,,445,"The Border Morning Mail and Riverina Times (Albury, NSW : 1903 - 1920)",212.93455505371094,very relevant
"Aboriginal  Stations.   At  a  recent  meeting  of  the  Aborigines  Board  in  Sydney,  a  report  was  read  from  the  local  board  at  Runnymede  re-    garding  the  aborigines  at  the  local home,  in  which  a  request  was  made  that  tools   be  supplied  for  the  use  of  the  institution.  It  stated  that  the  new  manager  was  giving  satisfaction,  and  that  there  were  a  large  number  of  young  children  at  the  place  that  required  attention,  and  that  there  was  no  school  within  some  miles  of    them.  The  secretary  was  instructed  to  make  enquiries  and  arrangements.  A  requisition  was  received  from  Runny-  mede  for  provisions,  at  a  cost  of  £33  14s,  and  was  approved.  A  report  from  the  Grafton  aboriginal  station  was  also  read.",127885170,https://api.trove.nla.gov.au/v3/newspaper/127885170,Aboriginal Stations.,Article,1901-05-03,2,2,"AT a recent meeting of the Aborigines Board in Sydney, a report was read from the local board at Runnymede regarding the aborigines at the local home,",https://nla.gov.au/nla.news-article127885170?searchTerm=aboriginal,,501,The Richmond River Herald and Northern Districts Advertiser (NSW : 1886 - 1942),212.93455505371094,very relevant
"Aboriginal  Murdered.   Tho  Commissioner  for  Police  has  re-  ceived  information  to  the  effect  that  an  African  negro  has  been  arrested  at  Burketown  on  a  charge  of  having  murdered  an  aboriginal.  It  appears  that  the  African   coveted  the  blackfellow's  wife,  and  treated  her  very  improperly.  He  was  running  away  with  her  when  the  woman's  husband  interfered,  and  the  African  immediately  killed  him.  Strange  to  say,  the  woman  has  not  been  seen  since  the  murder.",172575516,https://api.trove.nla.gov.au/v3/newspaper/172575516,Aboriginal Murdered.,Article,1902-12-26,2,2,"The Commissioner for Police has, received information to the offset that an African negro has been arrested at Burketown on a charge of having murdered",https://nla.gov.au/nla.news-article172575516?searchTerm=aboriginal,,840,"The Telegraph (Brisbane, Qld. : 1872 - 1947)",212.93455505371094,very relevant
"ABORIGINAL  IMPLEMENTS.   Dr.  Fritz  Noetling  read  a  paper  in  regard  to  the  names  of  na-  tive  weapons,  in  which  he  an-  alysed  carefully  all  that  is  known  in  regard  to  the  matter.  He  pointed  out  that  the  vocabulary  of  the  abori-  ginals  was  very  limited  in  extent.  Cal-  der,  whose  compilation  was  probably  the  most  comprehensive,  enumerated  only  1135  words,  some  of  which  were  unquestionably  adapted  from  European  sources.  The  results  of  his  investiga-  tion  tended  to  show  that  the  aborigin-  als  did  not  have  different  names  for  the  different  kinds  of  stone  imple-  ments  they  used.  If  it  could  be  prov-  ed,  as  he  thought  he  had  proved,  that  the  Tasmanian  natives  only  had  one  word  for  their  stone  implements,  and  it  was  by  no  means  too  rash  to  assume  that  those  races  which  populated  Eu-  rope  during  the  diluvial  and  tertiary  ages  also  used  one  word  to  designate  their  implements.  Mr.  R.M.  Johnstone  said  the  paper  was  one  of  the  most  important  he  had  listened  to.  Their  attention  hitherto  had  been  confined  to  the  things  them-  selves,  instead  of  to  the  language  ap-  plied  to  them.  Both  the  Tasmanian  and  Australian  races  would  afford  a  great  field  in  the  future  to  the  philolo-  gical  student,  and  Dr  Noetling  had  opened  up  a  question  that  would  be  pursued  with  great  interest.  It  was  the  beginning  of  a  very  important  study  in  connection  with  the  aborig-  inals.  He  pointed  out  that  already  an  important  work  had  been  perform-  ed  in  getting  phonographic  records  of  some  of  the  old  aboriginal  songs  and  speeches  by  the  late  Mrs.  Fanny  Smith,  who  was  the  last  living  des-  dendant  of  the  natives.  He  hoped  that  permanent  casts  of  these  records  would  be  made  ,  so  that  they  could  be  preserved  indefinitely.  They  would  he  justified  in  going  to  some  expense  to  preserve  these  last  records  of  an  extinct  race.  Mr.  H.  Ritz  said  that  there  was  no  record  of  the  actual  sounds  of  the  natives  gave  their  words.  The  records  were  very  meagre,  and  these  were  made  by  men  who  had  no  special  knowledge  of  philology.  The  number  of  words  in  the  aboriginal  language  was  small,  much  smaller  than  the  lists  which  had  been  drawn  up  would  lead  one  to  expect.  Many  of  the  words  appar-  ently  different  he  believed  to  be  really  blended,  and  the  apparent  difference  was  due  to  the  habit  the  Tasmanians  possessed,  in  common  with  the  South  Sea  Islanders,  of  interchanging  mem-  bers  of  various  sound  groups.  He  read  a  long  list  of  natives'  words  with  their  probable  meanings  and  conjectural  re-  lationships,  and  suggested  that  there  might  still  be  manuscripts  dealing  with  native  philology  in  existence  in  private  owners'  hands.  Dr.  Noetling  thought  that  Mr.  R.  M.  Johnstone's  suggestion  that  the  re-  cords  of  Mrs.  Fanny  Smith's  songs  and  speeches  should  be  preserved,  was  a  most  excellent  one.  The  object  of  his  paper  was  to  establish  whether  or  not  the  natives  gave  their  stone  imple-  ments  separate  named,  and  he  believ-  ed  it  could  be  shown  they  did  not.  Mr.  Bernard  Shaw  said  that  he  would  bring  the  question  of  getting  permanent  copies  of  the  Fanny  Smith  records  before  the  council.  Mr.  Russell  Young  thought  that  the  matter  of  expense  should  not  be  con-  sidered  if  they  could  obtain  permanent  records.  The  chairman  said  it  was  a  matter  of  regret  that  so  little  was  really  known  of  the  early  history  of  the  Tas-  manian  natives.  No  attempt  had  been  made  to  record  their  language  until  it  had  become  to  some  extent  corrupted  by  contact  with  Europeans  and  others.  He  thought  Dr.  Noetling's  paper  was  a  very  valuable  and  important  ome,  and  he  believed  it  was  only  one  of  many  that  would  be  equally  interest-  ing.  After  further  discussion,  the  meet-  ing  terminated.",180202782,https://api.trove.nla.gov.au/v3/newspaper/180202782,ABORIGINAL IMPLEMENTS.,Article,1908-10-13,7,7,"Dr. Fritz Noetling read a paper in regard to the names of na[?] weapons, in which he analysed carefully all that is known",https://nla.gov.au/nla.news-article180202782?searchTerm=aboriginal,,860,"Daily Post (Hobart, Tas. : 1908 - 1918)",212.93455505371094,very relevant
"ABORIGINAL  SHEARERS.   A  Victorian  contemporary  memtions  that  about  20  aboriginals  from  Swan  Hill  have  just  completed  a  shearing  contract  at  one  of  the  sheep  stations  in  the  Lin-  tons  district.  The  men,  who  were  ex-  perts  with  the  shears,  made  top  wages  in  their  work.",180396996,https://api.trove.nla.gov.au/v3/newspaper/180396996,ABORIGINAL SHEARERS.,Article,1905-11-23,2,2,A Victorian contemporary mentions that about 20 aboriginals from Swan Hill have just completed a shearing contract at one of the sheep stations in the,https://nla.gov.au/nla.news-article180396996?searchTerm=aboriginal,,834,Darling Downs Gazette (Qld. : 1881 - 1922),212.93455505371094,very relevant
"Aboriginal  Murders.   .  Information  has  been  received  in  Brisbane   that  the  inquiry  into  the  alleged  murders  of  aboriginals  by  troopers  in  the  northern  portion   Iiob  WumAfmolttiiaJ  -  TfwilltiA   tof  Queensland  has  been  concluded.'  It  Trill  be   remembered  that  the  Commissioner  of  Police   JpSr*  W.  E.  Parry-OkedenJ  left  Brisbane  come  time  ago  to  hold  the  inquiry  in  ^conjunction  with  Br.  Both.  The  taking  [of  evidence  was  .  concluded  yesterday   .  Hqreton,  and  Hr.  Okeden  leaves  Hot  Bertiehangh  to-day.  He  will  nrobably  ieave  for  Thursday  Island  on  Thursday.  {Information  has""  also  been  received   'that  the  Commissioner  ana  the  whole   '  'of  the  troopers  have  been  '  suffering   from  influenza.  As  to  the  result  of  the  inquiry,  it  is  stated  that  this  will  not  be  made  known  until  after  the  Commissioner  has  made  his  report  ,'to  the  Home  Secretary.  It  is  not  known   whether  the  Commissioner  will  make  an  in   spection  of  the  various  police  stations  en  route   *to  Brisbane.",183943404,https://api.trove.nla.gov.au/v3/newspaper/183943404,Aboriginal Murders.,Article,1902-09-26,24,24,Information has been received in Brisbane that the inquiry into the alleged murders of aboriginals by troopers in the northern portion of Queensland has been concluded. It Will be,https://nla.gov.au/nla.news-article183943404?searchTerm=aboriginal,,891,"The Week (Brisbane, Qld. : 1876 - 1934)",212.93455505371094,very relevant
